headline,is_clickbait
A Roll Call to Honor Buried Veterans,0
Bill Sweetenham cleared of bullying allegations,0
16 Pets Who Just Want To Bring A Lil' Sunshine Into Your Life,1
Panic! At The Disco's New Music Video Is The Creepiest Thing You'll See All Week,1
Solar-powered airplane makes first international flight,0
Matthew McConaughey Doesn't Look Like This Any More,1
"HiNet, WCG, and WGT unite holding Taiwanese Gaming Athletes' Qualification",0
"Welp, We Had Adults Try Human Breast Milk",1
British Columbia teachers dropping the chalk and walking out,0
Spanish Bailout Rattles Bank Shares,0
Draft constitution pushed into Iraqi parliament,0
FCC requires VoIP providers to have 911 service,0
"30 Things You Might Not Know About ""Galavant"" Star Luke Youngblood",1
Title IX Ruling Involving U.C. Davis Could Lead to Stricter Standards,0
Prosecutors Seek Appeal in Dismissal of Gun Case,0
9 Brutally Honest Confessions From Zayn Malik's First Solo Interview,1
"Wales win Grand Slam, RBS Six Nations and the Triple Crown",0
Blue Coat and AT&T take parts of FOSI for Internet Security,0
Armed gunmen attack cruise ship off Somali coast,0
"Things You Might Not Know About Taylor Swift's ""Out Of The Woods"" Video",1
"Big Election, Teeny, Tiny (if Any) Ideas",0
Which Of These Foods Is The Grossest,1
Discriminatory job ad by Central Bank of Turkey asks for men only,0
Is This A Diploma Or Toilet Paper,1
17 QVC Fails Guaranteed To Make You Laugh,1
27 Pictures That Are Way Too Real If You Have A Four-Person Family,1
Hughes Makes His Case as Yankees Win Eighth Straight,0
Distance Insulates Journalists Who Use Private Information,0
21 Things Only MAC Lovers Can Truly Appreciate,1
13 Fun Activities You May Technically Be Able To Do On Mars,1
31 Real-Life Bridal Parties Who Nailed The Mix 'N' Match Look,1
Everything Donald Trump Looked Like In 2015,1
First Libertarian Party presidential nominee John Hospers dies at 93,0
13 Of The Best Beauty Products Our Editors Bought In 2015,1
Which Candy Is The Best,1
What Are You Sick Of Hearing As A Non-Harry Potter Fan,1
"OCTranspo's ""new year"" of efficiencies?",0
Australian Prime Minister's popularity at all time low,0
It Has Come To Our Attention That Gigi And Bella Hadid's Younger Brother Is Very Adorable,1
"Paralympian Forced To ""Drag"" Herself Off Airplane After Being Left Onboard",1
"If You're Excited For The New ""Star Wars"" Movie You Have To See This Art",1
Baseball Homecomings for Ken Griffey Jr. and Jason Giambi,0
13 Apps That'll Make Your iPhone-Android Relationship So Much Better,1
What It Feels Like When You Make Your Crush Laugh,1
Should You Instagram Your Brunch Or Nah,1
