headline,is_clickbait
11-Year-Old Bicyclist Called Out Reckless Drivers Like A Boss,1
What Would Your Life Be Like As A Lame Super Hero,1
17 Faces Everyone Who's Experienced Halloween In The Cold Will Understand,1
16 Held in Coup Effort in Equatorial Guinea,0
Can You Guess The Celebrity Hiding Behind The Inanimate Object,1
22 Times Animals Were You Just Trying To Live Your Life,1
Senior diplomat criticizes U.S. policy in Iraq,0
I.R.S. Thwarted as Court Shields Textron Tax Papers,0
17 Confessions From People Who Have Never Masturbated,1
Pigskin A Blanket: NFL Week 15 Picks,1
Insurance Change for Veterans Is Scrapped,0
Australian rules football: 2010 Gippsland Football League round 13 - Traralgon defeat Sale,0
Why I Hate Camping,1
32 Online Shops Based In The Southwest You Should Be Shopping At,1
Australian warship sunk as artificial reef,0
Crippling the Palestinian Cause,0
Italian football: Roma and Lazio accused of fixing game,0
"With Late Push, Johnson Edges Hamlin at Martinsville",0
21 Of The Weirdest News Stories From New Jersey In 2015,1
Which Early 2000s Disney Show Matches Your Zodiac,1
21 Secrets A Third Wheel Will Never Tell You,1
Two charged in Heathrow bomb threat,0
17 Pictures You'll Only Appreciate If You're Ready For Christmas,1
Colombian soldiers killed by rebel group,0
If Couples Honestly Updated Their Facebook,1
Here's How To Actually Reuse Your Wedding Dress In A Beautiful Way,1
Clinton wins West Virginia Democratic primary,0
19 Surprising Confessions About Anal Sex,1
Aziz Ansari Called Out The Whiteness Of Late Night To Stephen Colbert,1
Beijing cracks down on manhole cover thefts,0
21 Halloween Costumes That Really Make No Sense,1
37 Cozy Sweaters For People Who Are Literally Always Cold,1
Don't Auto-Update Your iPhone Overnight Unless You Want To Be Late To Work,1
"Soaring, Never Boring",0
"17 Of The Most Unforgettable Moments From ""The Bachelor"" In 2015",1
"After Stimulus Package, Pentagon Officials Are Preparing to Pare Back",0
Church of Scientology warns Wikileaks over documents,0
BBC to cut Electric Proms for financial reasons,0
The 27 Most Annoying Things Every Bartender Has To Endure,1
"11 Times Helena From ""Orphan Black"" Was Too Cute To Be A Psychopath",1
English Sweep Across Europe Once Again,0
Red Wings Come on Strong in Third Period to Take Game 1,0
Socialists win second term as Spain's ruling party,0
Rhode Island borrows $90 million from US for jobless claims,0
Climber dies on Mount Cook,0
43 Of Our Most Amazing Celebrity Photos Of 2015,1
Sabbatini and Mallinger Tied for Byron Nelson Lead,0
Hundreds of Czech far-right activists detained after anti-Roma protests,0
Destroyed Kelso High School to be rebuilt,0
Play This Drinking Game If You're Spending The Holidays With In-Laws,1
What Does Your Choice Of Whiskey Say About You,1
North Korea Says Journalists Admitted Crimes,0
19 Practical Things You Should Actually Ask For For Christmas,1
We Need To Talk About Peanut Butter Baby Right Now,1
"Aid to Poor Nations Rises, but Even More Is Asked",0
Renowned Indian guru Śrī Satya Sai Baba dies aged 84,0
More Americans Joining Military as Jobs Dwindle,0
"Stores drop game ""Grand Theft Auto: San Andreas"" after given 'Adults Only' rating",0
Crash in Indonesia Kills More Than 90,0
"Watch Amy Poehler Absolutely Slay A Cover Of ""The Rose""",1
"Did The New ""Star Wars"" TV Spot Give Away A Secret About Han Solo",1
British snooker commentator Ted Lowe dies aged 90,0
"New York area blog spawns book deal, NBC sitcom",0
Which 2015 Meme Are You,1
The Woman Leading A Crusade To Tell More Asian-American Stories,1
Here's What Phoebe Buffay's Apartment Looks Like In Real Life,1
2 Die in Clash in India,0
11 Ways Your Makeup Can Literally Turn You On,1
Bull moose shot by police in Alaska,0
Detroit Council Member Pleads Guilty to Accepting Bribes for Vote,0
Tanker explodes on I-75 north of Detroit,0
North Korea to Put U.S. Journalists on Trial,0
Adele And Lady Gaga's Hot Bodyguard Will Leave You Compulsively Thrusting,1
Chilean Town Withers in Free Market for Water,0
"Suicide bomber assassinates prominent Shia cleric in Karachi, Pakistan",0
La Liga fixtures face delay due to players' strike,0
Sony in Expansion of U.S. and Foreign TV Business,0
UK Serious Fraud Office to investigate MG Rover collapse,0
Pope Celebrates Mass in Jordan,0
"27 Parents' Reactions To ""Netflix And Chill""",1
Do You Have What It Takes To *Get* This Crossword Puzzle,1
America's Cup: seventh race postponed,0
"Michael J Fox And Christopher Lloyd Crashed ""Jimmy Kimmel Live"" As Marty McFly And Doc Brown",1
World's oldest leather shoe found in Armenia,0
A Slight Upgrade in Quarterly G.D.P.,0
Atomic Agency Fails to Choose New Head on First Ballots,0
What Will Your 2016 Good Luck Symbol Be,1
G.M. Bondholders Express Skepticism of Restructuring Plan,0
Ash from Iceland volcano could affect UK flights,0
"Former Driver Sues Eddy Curry, Alleging Sexual Harassment",0
Moldovan parliament approves new government,0
25 Delightfully Cozy Gifts For Anyone Who Hates Leaving The House,1
What Is Your Weirdest Fear,1
Which 2015 Slang Term Are You Based On Your Zodiac Sign,1
MyBook Disk Drive Handles Lots of Easy Backups,0
Yahoo Reports a Fourth-Quarter Loss,0
US unemployment rate highest in 26 years,0
These Dogs Are Best Friends And They're Destroying The Internet's Heart,1
Are You More Vincent Crabbe Or Gregory Goyle,1
Kendall Jenner And Gigi Hadid (aka KenGi) Are The Ultimate Friendship Goals,1
What's Your Friendship Forecast According To The Tarot,1
21 Scruffy Men That'll Get You All Hot And Bothered,1
Zayn Malik's First Solo Single Is Coming Out This Week,1
15 Pictures Of Renaissance Women With Spectacular Gravity-Defying Boobs,1
"Closing the Roof on a New Era, for Better and Worse",0
What Should Your New Year's Resolution Be Based On Your Zodiac Sign,1
Scottish judge criticises medical care of murdered baby,0
"DNA Tests Prove Michigan Man, Searching for Origins, Was Not Kidnapped Toddler",0
34 Questions Stephenie Meyer Needs To Answer Immediately,1
"Two news helicopters crash in Phoenix, Arizona",0
Molly Is 16. Her Justin Bieber Is Bernie Sanders,1
Gabrielle Union Hilariously Pretended Not To Know Who Stacey Dash Is,1
Israeli Vote Brings Push for Release of a Soldier,0
What Kind Of Animal Is On Niall's Shirt In The New One Direction Music Video,1
Judge Dismisses Insider Trading Suit Against Mark Cuban,0
British painter Lucian Freud dies aged 88,0
El Salvador elects leftist president Funes,0
1200 schools may be closed by UK teachers strike,0
Here Are 19 Insanely Popular Crock Pot Recipes,1
Can You Tell If These Are Welsh Towns Or Harry Potter Spells,1
This Baby Got Really Confused When He Was Babysat By His Dad's Twin,1
"The Chicken Enthusiast Is The Greatest ""Bachelor"" Contestant To Ever Exist",1
Pakistan's intelligence agency said to support Taliban,0
So Yeah Taco Bell Has Drive Through Signs That Look Like Giant Penises,1
London bomb survivors launch campaign for public inquiry,0
"What Percentage Kardashian Are You, Based On 3 Questions",1
"Steelers, Cardinals win championship games to advance to Super Bowl XLIII",0
21 Awesome '80s Girls Toys That Are Worth A Small Fortune Now,1
Euro 2008: Portugal vs. Czech Republic,0
15 Insanely Delicious Stuffed Cookies That Are Better Than A Boyfriend,1
Drug cartel and police shootouts erupt in Mexico,0
France Expands Financial Aid for Its Newspapers,0
S.E.C. Faces Fresh Scrutiny Over Trading Inquiry at Lehman,0
Rescued Captain Returns to Vermont Town,0
World War II veteran regains use of second eye after freak accident,0
15 Brutally Honest Tube Badges Every Londoner Needs Right Now,1
UEFA Champions League 2008–09 Qualification: 42 Clubs learn their fate for First and Second Qualifying Rounds,0
Oak Park and neighbors to study Les Golden's intergovernmental cooperation proposals,0
Opera Internet browser goes ad-free,0
Can You Name The Stuff In Our Solar System,1
13 Kids Who Have Wayyy More Swag Than You,1
Age of Aquarius Dawns Again on Madison Ave.,0
Winning British EuroMillions lottery ticket worth £56 million claimed,0
Here's How To Try Black Tap Milkshakes Without Spending $15,1
"Nike Orders Fall 12%, Sending Shares Down 4.6%",0
21 Pictures That Girls Will Just Never Understand,1
"Brace Yourself, America, All Dressed Chips Are Coming",1
Here's What You Need To Know About The Indian Law That Let Police Arrest An Actor For Mimicry,1
"Do You Remember The Lyrics To ""Welcome To The Tipton"" From ""The Suite Life Of Zack And Cody""",1
Here's What To Do If Your Phone's Storage Is Full,1
STS-116 launch scrubbed,0
In Loving Memory Of Joe Jonas And Gigi Hadid,1
"World's cheapest car launched in India, will go on sale in April",0
Businesses and individuals worldwide to turn lights off as part of Earth Hour 2009,0
U.N. denied access to Guantanamo inmates,0
Lundqvist Leads Rangers to 2-0 Series Lead,0
19 Stunningly Weird Pieces Of Anatomy Jewelry,1
11 Charts That Are Way Too Real For Singers,1
24 Pictures That Prove Kids Invented Being Assholes,1
18 Hilarious Bollywood Movie Reviews From Commenters On Torrent Sites,1
Skeleton Makeup Tutorial,1
Four young girls killed in Zambia wall collapse,0
"Suzanne Collins Wrote A Touching Letter Saying Goodbye To The ""Hunger Games"" Series",1
Just 27 Surprisingly Funny Tweets About Cats,1
"How Well Do You Remember ""I Put A Spell On You"" From ""Hocus Pocus""",1
Sarah Paulson And Holland Taylor Are Dating And It's Everything,1
ETA places explosives on Tour de France route in Spain,0
11 Ways To Actually Become A Person Who Works Out,1
The Most Beautiful Wedding Dresses You've Never Seen Are From Asia,1
India and Pakistan Agree to Fight Terror Together,0
How Well Do You Know Earth From Space,1
This Blog Full Of Hairy Ball Landscapes Will Make You Want To Gouge Your Eyes Out (NSFW),1
Nelson Mandela hospitalised again with lung infection recurrence,0
23 Wonderfully Cozy Things You Need To Bake This Fall,1
"12 ""Harry Potter"" Quotes That Could Totally Be About Your Desi Life",1
"Again, Santana Shines and Mets Fail to Help",0
People Try Activated Charcoal Drinks,1
Who Said It: Kendall Or A Ken Doll,1
Canadian National Exhibition takes place in Toronto,0
17 Unusual And Beautiful Russian Baby Names,1
European Parliament approves accession of Romania and Bulgaria to the EU,0
We Know Whether You Should Really COME TO BRAZIL,1
This Is How Miss America Winners' Bodies Have Changed Since 1921,1
"21 Steps To Becoming Obsessed With ""Hamilton""",1
13 Terrible Photos People Took Of The Eclipse With Their Phones,1
Cool front to bring lasting relief for Texas,0
We Know If You Have A Pimple On Your Face Based On A Single Question,1
"Which ""Hunger Games: Mockingjay, Part 2"" Character Are You",1
22 Dogs Who Totally Nailed Their Geeky Halloween Costumes,1
Home Depot Raises Its Outlook for Year,0
"15 Reasons Link From ""Zelda"" Is The Perfect Man",1
Riots cease in Dublin against Unionist march,0
Can You Name These Adorable Instagram-Famous Pets,1
Pittsburgh Caps Rally to Win Stanley Cup,0
20 Things You'll Understand If You've Ever Had Anal Sex,1
95 Thoughts Everyone Has When They Are Stoned AF,1
Which Makeup Brand Should You Use Based On Your Zodiac Sign,1
Long-running TV clown marks 50 years since debut,0
"A timeline: Novak, Rove, Cooper",0
How Much Of A Halloween Fan Are You Actually,1
"Colin Powell Resigns as U.S. Secretary of State, Rice Likely Successor",0
"Seven-year-old raises £100,000 for Haiti in sponsored bike ride",0
"Hallelujah, Gigi Hadid Is Single Again",1
"In Mexico, Curbing Violence Before It Is Learned",0
Hamas to Start Paying Gaza Residents Compensation and Reconstruction Aid,0
Tyco executives found guilty,0
"17 ""Family Feud"" Answers That Will Never Stop Being Funny",1
"17 People Who Thought Bryan Adams Covered Taylor Swift's ""1989""",1
Which Recent Kanye West Tweet Are You Based On Your Birth Month,1
That Awkward Moment You're The Only One Not Invited,1
UN wants Gaddafi's death probed,0
Which Jessie J. Song Are You,1
What Does Your Favorite Color Scheme Say About You,1
People Are Mourning David Bowie On Twitter And It's Both Moving And Heartbreaking,1
Results of the 2005 New Zealand General Election,0
Vienna mayor criticises cancellation of Michael Jackson tribute concert,0
CBC service returns to normal tomorrow,0
MST attack in Rondonia kills one man,0
"Stephen Colbert Gives Us The Trump We Need On ""The Late Show""",1
Lower Oil Prices Hurt ConocoPhillips Earnings,0
Here's Everything You Need To Know About Renters Insurance,1
21 Times Renato Nicoli Sampaio's Instagram Made You Beyond Thirsty,1
23 Yahoo Questions That Will Destroy Your Faith In Humanity,1
"I Dressed My Dog Up As Chanel From ""Scream Queens"" And Now She Wants To Murder Me",1
Here's Why You've Been Eating French Toast Wrong Your Entire Life,1
Scottish FA apologise after fans boo Liechtenstein national anthem,0
Moscow detains anti-Kremlin protesters,0
20 Badass Tattoos Inspired By Health And Wellness,1
Former Iran President at Center of Fight Between Classes of the Political Elite,0
21 Things You'll Understand If You've Ever Been To The Cheesecake Factory,1
Home Refinancing Hobbled by Variety of Obstacles,0
Hasegawa retains Bantamweight title,0
This Man Made His Wife's Most Random Texts Into A Hilarious Collage,1
21 Confessions From People Who Can't Put Their E-Books Down,1
11 Most Insane Things That Happened In Pennsylvania In 2015,1
21 Embarrassing Liz Lemon Moments That'll Make You Feel Better About Your Own,1
Chinalco to Invest $19.5 Billion in Rio Tinto,0
Disgruntled Mexicans Plan an Election Message to Politicians: We Prefer Nobody,0
12 Inspiring Fashion Illustrators To Follow On Instagram,1
Thirteen arrested in connection with Baghdad bombings,0
"After Coyote Attacks, a Denver Suburb Turns to a Gun-Wielding Trapper",0
24 Hilarious Schmidt Quotes That Will Never Get Old,1
Kids Explaining What Love Is Will Make You Laugh And Then Cry,1
"Police in Salinas, California identify teenage gunshot victim",0
Are You More Jack Black Or Jack White,1
18 Of The Most WTF Photoshop Fails Of 2015,1
U.S. Senator Tim Johnson hospitalized,0
Harvard Law School gives its highest honour to Pakistani judge,0
GM posts first annual loss since 1992,0
Rocket attack on USS Ashland docked in Jordan; another rocket fired at Israeli town,0
BMW Cuts Jobs at Plant That Makes the Mini,0
Brandeis Says It Plans to Sell Art Collection to Raise Cash,0
16 Tweets That Sum Up The Lengths You Would Go To Avoid Other People,1
NBA: LeBron James announces that he will join the Miami Heat,0
South Korea and US hold joint exercises; North does not retaliate,0
Which Badass Anime Character Are You,1
26 People Who Completely Failed At Cooking,1
Pitched Battle Between Bears and Bulls on Wall St.,0
"Locks Still Flowing 20 Years Later, Ron Duguay Returns to the Ice",0
England off to electric start in Women's Euro 2005 football championship,0
Microsoft Sues Three in Click-Fraud Scheme,0
"H5N1 Avian Flu virus has mutated, study says",0
Why the Civilian Toll After D-Day Is Different From That in Afghanistan,0
Blockbuster Reports Loss and Restructures Its Debt,0
These Canadians Won Lots Of Money And Then Took An Adorable Photo,1
Iranian president says move Israel to Europe,0
Poland wins the 2008 Eurovision Dance Contest,0
JPMorgan Pulled Cash Early From Madoff-Linked Funds,0
11-year-old California girl charged for throwing stone in defense,0
Parajet Skycar expedition takes off from London to Timbuktu,0
32 Ways To Actually Wake Yourself Up In The Morning,1
ELF Cup kicks off in Turkish Republic of Northern Cyprus,0
"German Gunman, 17, Attacks School in Winnenden; 16 Are Dead",0
Iraqis say U.S. bombing killed 39 civilians,0
American guru Joseph M. Juran dies at age 103,0
Kamchatka deep-focus underwater earthquake reaches Moscow,0
Davey Johnson Has a Soft Spot for Dutch Baseball Team,0
"United Airlines to hire 2,000 flight attendants",0
"Contractor Must Pay in Iraq Fraud, Court Rules",0
"Cambridge, Mass., city council recommends construction firm W. R. Grace remain under DEP supervision for asbestos contamination",0
British Bank Northern Rock Plans to Increase Lending,0
MV Sirius Star oil tanker released by pirates,0
19 Insanely Delicious And Healthy Ways To Enjoy Gingerbread For Breakfast,1
Can You Spell These Commonly Misspelled Canadian Words,1
27 Things You Need To Up Your Shower Game,1
William Morris and Endeavor to Become One Talent Agency,0
This Is Why Mainland Europe Is Better At Christmas Than Everyone Else,1
13 Things Everyone Who Has Survived Christmas Will Understand,1
Plane crash in California kills three,0
"This College Marching Band Just Shut It Down With Their Amazing ""Hello"" Cover",1
Olympic torch faces protests in San Francisco,0
"$8,000 Phobos Media Center Comes With a Tech",0
Russia Ends Operations in Chechnya,0
17 Things Kanye West Could've Named His New Album,1
Tell Us About Yourself(ie): Derek Theler,1
P!nk Wrote Ellen Degeneres A Super Sweet New Theme Song,1
"As The Boston Globe Quietly Struggled, Confusion Prevailed",0
21 Crockpot Soups Guaranteed To Help You Brave The Cold,1
Which J.Lo Song Are You,1
"Stephanie Mills Destroyed Us In NBC's ""The Wiz""",1
Blake Lively Sent Taylor Swift A Birthday Pie Topped With Mini Versions Of Her Cats,1
Met Victory With a Switch: The Hitters Bail Out Santana,0
European Union Lifts Ban on Indonesian Airlines,0
This Dog Could Not Be More Chill About The Election,1
We Asked 12 Scientists How Their Faith Affects Their Work,1
"Morsi forced out by Egyptian Military, chaos ensues",0
Amul's New Cartoon Perfectly Mocks Jayalalithaa's Relief Sticker Debacle,1
Arson charge for man who cleaned home with gasoline,0
Russian Military Cuts Leave Soldiers Adrift,0
All The Looks At The 2016 Producers Guild Awards,1
Even Forbes Is Pinching Pennies,0
How Many James Bond Films Have You Seen,1
How Many Of These Gamer Terms Do You Actually Know,1
Vietnam denies blocking social networking site Facebook,0
Little League Puts a Special Focus on Urban Programs,0
Hedge Funds Agree to Return $235 Million in Madoff Case,0
21 Things All Best Friends Will Understand,1
We Tried Five Weeks Of Ballet Fitness And This Is What Happened,1
United States Justice Department opens investigation into White House leaks,0
Tommy Thompson steps down as Secretary of Health and Human Services,0
"How Well Do You Remember The Lyrics To Sum 41's ""Still Waiting""",1
Steelers Owner Dan Rooney Turns His Business Into a Family,0
Pro-Manny Crowd Welcomes the Anti-Ramirez,0
FBI details chief justice's prescription drug trouble,0
Cyclone Aila Kills 191 in South Asia,0
What's The Funniest Reason You've Cried While On Your Period,1
The Diverse World Of London As Seen Through Bus Windows,1
31 Stocking Stuffers For Every Harry Potter Fan,1
"22 Mesmerizing, Mundane Photos Of A Day In The Life Of Darth Vader",1
Georgia Shoots 3 Men Wanted in Rebellion,0
Sealing in New Delhi put off until Monday,0
16 Celebrities You Had No Idea Were British,1
Please Answer This Incredibly Important Teeth Brushing Poll,1
"Roommates Played Very Honest Game Of ""Truth Or Drink""",1
17 Insanely Delicious Ways To Cook Butternut Squash This Fall,1
Yankees win 3 in 4 game series with Red Sox,0
NYC's transit workers approve strike authorization,0
Which IKEA Product Are You,1
Shea Rests in Pieces as Last Section Is Torn Down,0
Australian Immigration department removal of citizen was unlawful,0
U.S. Supreme Court Justice David Souter to retire,0
5 Great Books To Read In February,1
"ASIO settle out of court, wrongful detention case",0
"Pushed to the Edge, the Celtics Climb Back",0
Bacon-Wrapped Appetizers,1
Watch These Grown-Ups Freak Out Over Virtual Puppies,1
A City Adds a String of Arsons to Its List of Troubles,0
Marketers Lend Voices to Support the Disabled,0
"Nicki Minaj's Face While Jennifer Lopez Danced To ""Anaconda"" Is Everything And More",1
This Introverted Teen Just Released The Most Relatable Album Of The Year,1
How Wild Was Your Weekend,1
Coulthard says Piquet should have been punished for F1 cheating,0
"17 Things You Should Never, Ever Share",1
"What Job Would You Have In The ""Game Of Thrones"" World",1
Some Terms Reached in Honduras Dispute,0
When You're A Girl With A Dirty Mind,1
"Leaving Israel, Pope Benedict Offers Stronger Holocaust Message",0
Which Of Taylor Swift's Grammys Are You,1
A Polymer Coating That Can Heal Itself Thanks to UV Light,0
Natural gas odor permeates New York and Jersey Cities,0
Women in South Africa advancing in fields of science and technology,0
"ITER, a Clean Energy Fusion Project, Promises Unlimited Electricity",0
"Here's The Trailer For ""Trolls"" Starring Anna Kendrick And Justin Timberlake",1
Which Pawnee City Hall Mural Are You,1
"Vietnam fishing vessel sinks in South China Sea, 27 missing",0
Ellen DeGeneres Scared The Shit Out Of Emily Blunt While She Was Dressed As Lady Liberty,1
13 Awards Amy Poehler's Definitely Earned,1
Fatal US Army helicopter collision in Iraq blamed on enemy fire,0
7 Simple Ways To Make This Week A Little Less Shitty,1
Which Gotham Girl Are You,1
"As Factories Close, Graduates Focus More on College",0
What's The Best Fanfiction You've Ever Read,1
25 Movies From The '00s That Are So Bad They're Good,1
New Search Technologies Mine the Web More Deeply,0
Trial begins for Canadian soldier accused of murder in battlefield killing,0
Pakistani militants take hostages in Karachi base revenge attack; ten soldiers killed,0
Lawson and His Big Toe Help North Carolina Run Past Gonzaga,0
UK military deaths in Afghanistan reach 327,0
First fifty-star United States flag up for sale,0
Madoff Never Made Supposed Investments,0
These Gadgets Will Make You Believe In The Future Of Food,1
You're Going To Start Seeing Live Photos on Facebook,1
China Reports Falling Prices and  Low Demand,0
Can You Pass Our Britishness Exam,1
Australian Labor Party shelves government oversight of media legislation,0
You Will Want To Marry And Have Babies With This Lumberjack Cake,1
NASA Optimistic That Debris Did Not Damage Shuttle,0
Colombian unions reiterate their accusations against Coca Cola,0
These Comics About Facebook Are Too Real,1
Minnesota boy with cancer and mother return to abide by court rulings,0
Three Walks in the 10th Push the Mets Past the Braves,0
"An American Filmmaker Couldn't Get A Visa To India, So He's Directing A Film Over Skype",1
22 Pictures People Who Aren't Grad Students Will Never Understand,1
Once You See Jamie Fraser Your Life Will Never Be The Same Again,1
Toyota's US sales fall by 8.7%,0
When You Go To Work Naked,1
Today's Good Nice Horoscope For All Humans,1
Can We Guess Your Favorite Animal Based On Your Favorite Actor,1
2010 FIFA World Cup: Spain beats Chile; both go to second round,0
Which Heroine From A Video Game Are You,1
House votes to limit Patriot Act,0
Deadly forest fire in Spain claims lives of firefighters,0
Polish humanitarian Irena Sendler dies at age 98,0
Critics honor 2004-2005 best in U.S. TV,0
18 Reasons Why No Country Should Ever Accept Refugees,1
Minimum wage in United Kingdom increases to £5.05,0
US singer Etta James dies aged 73,0
Kanye West Allegedly Paid His Models $100 For A 10-Hour Workday,1
"19 Out -Of-This-World ""Star Wars"" Crafts To Keep Die-Hard Fans Busy",1
9 Women Share The Harsh Reality Of Living With Severe Acne,1
11 People Who Look Strikingly Similar To Leonardo DiCaprio,1
"Cuban funds tied to Lula campaign, Brazilian magazine alleges",0
You Have To See This Guy's Sweet Reaction To Finding Out He's Going To Be A Dad,1
This District Magistrate Had A Meal Cooked By A Widow To Dispel Villagers' Superstitions,1
"Quarterly Earnings Fall at Staples, as Sales Grow 19%",0
"Car crashes into house in Suffolk, UK, seriously injuring man",0
Scotland's Dario Franchitti wins Indianapolis 500,0
22 Pictures People Who Are Good Students Will Never Understand,1
27 Women Sexily Consuming Chocolate,1
Liberty Collects First Victory,0
Major new bird flu outbreaks reported in Asia,0
NASA's Phoenix spacecraft lands safely on Mars,0
South African former apartheid party dissolves,0
One Out (Girardi) Leads to Eight Runs as Yankees Beat Braves,0
"Leery of Debt, Germany Shuns a Spending Spree",0
New Glitter Roots Hair Trend Has Women Dumping Sparkles Onto Their Heads,1
Signs You're Dating The Wrong Person,1
"With Help, Conductor and Wife Ended Lives",0
Shuttle Set to Lift Off With Station Parts,0
Using Science To Analyze Oprah's Insane Audience Reactions Is Hilarious,1
"18 Things ""Back To The Future"" Forgot To Predict",1
Imprisoned Haitian priest may need US doctors,0
Congress Passes Bill to Tighten Weapons Programs,0
"Preakness won by Afleet Alex, Kentucky Derby Winner Third",0
These Cute Kids Were Hooked Up To A Lie Detector Test In Front Of Santa And It Was Adorable,1
"Wikinews interviews Brenton Clutterbuck, candidate for the electorate of Maroochydore at the upcoming Queensland election",0
Steelers Shared Resources With 2 Teams During World War II,0
21 People Who Embraced Being Weird In 2015,1
Fans Are Still Finding Value in Shea Stadium,0
18 Dreamy Gifts For Anyone Who Is Obsessed With Traveling,1
"India's Agni-III test termed a ""partial success"".",0
Can We Guess Your Favorite Avril Lavigne Song Based On Your Zodiac,1
Report Says Principal Put Dallas Students in Fight Cage,0
25 Parents Share The Parenting Hacks They Can't Live Without,1
69 Excellent Indie Records You May Have Missed In 2015,1
MTV and VH1 to broadcast Live 8,0
"Kanye West Finally Tweeted Something Lovely And It's About North, Obviously",1
Working Out the Details of Guns in National Parks,0
Texas defeats USC in 2006 Rose Bowl,0
Australia women's national goalball team loses 0-3 to United States in pool play in London,0
12 Times Badass Women Fought Ridiculously Sexist Dress Codes In 2015,1
"Chinese police offer 300,000 yuan reward in double bus bombings",0
11 Real Retail Worker Confessions,1
Your Chance to Show What the Super Bowl Logo Should Look Like,0
These Easy Pizza Pinwheels Are Delicious AF,1
